<?xml version="1.0"?>
<!DOCTYPE School SYSTEM "/home/valuelabs/Programs/XML/School.dtd"> 
<School>
	<Class>
		<ClassName>Seventh</ClassName>
		<Student>
			<Name>Sachin</Name>
			<DOB>1991-04-02</DOB>
			<Address>Mumbai</Address>
		</Student>
		<Student>
			<Name>Dravid</Name>
			<DOB>1990-05-02</DOB>
			<Address>Banglore</Address>
		</Student>
		<Student>
			<Name>Kohli</Name>
			<DOB>1994-06-04</DOB>
			<Address>Delhi</Address>
		</Student>
		<Teacher>
			<Name>A</Name>
		</Teacher>
		<Subjects>
			<Name>English</Name>
			<Name>Science</Name>
			<Name>Telugu</Name>
		</Subjects>
	</Class>
	<Class>
		<ClassName>Tenth</ClassName>
		<Student>
			<Name>Dhoni</Name>
			<DOB>1991-04-01</DOB>
			<Address>Chennai</Address>
		</Student>
		<Student>
			<Name>Yuvi</Name>
			<DOB>1993-08-03</DOB>
			<Address>Punjab</Address>
		</Student>
		<Student>
			<Name>Raina</Name>
			<DOB>1996-10-06</DOB>
			<Address>Jaipur</Address>
		</Student>
		<Teacher>
			<Name>B</Name>
		</Teacher>
		<Subjects>
			<Name>Maths</Name>
			<Name>Physics</Name>
			<Name>Chemistry</Name>
		</Subjects>
	</Class>
</School>
